### ISSUE TITLE
iOS/macOS: tunnel's default route makes it PrimaryInterface, breaking HomeKit camera live streams

### ISSUE THREAD

**Issue by yamogoon** [NodePassProject/Anywhere#107]
## Summary

The packet tunnel installs a `default` route and therefore becomes the system's primary interface. As a result `homed` binds its SRTP sockets to the tunnel address instead of the LAN address, and HomeKit camera live streams never start — the accessory has no route back to the tunnel address, so its RTP replies are dropped.

Affects both iOS and macOS. The mechanism is platform-shared (same `NEPacketTunnelProvider`, same `homed`).

"Exclude local networks" is already enabled and does not help. The outbound packets are already routed directly over the LAN interface; what breaks is the **source address** `homed` selects.

## Environment

- Anywhere 2.0 (build 340)
- macOS 26.6.2 (25G83), Apple Silicon — iOS build running on macOS
- iPhone, iOS 26.6
- Config: VLESS + REALITY, `proxyMode = rule`
- `tunnelIncludeLocalNetworks = false`, `tunnelIncludeAllNetworks = false`

## Steps to reproduce

1. Have a HomeKit camera on the same LAN as the device.
2. Connect Anywhere.
3. Open Home.app and open the camera's live view.

**Expected:** the live stream starts.
**Actual:** the still preview loads, the live view spins indefinitely.

Disconnecting the VPN makes the stream work immediately.

## Evidence

Measured on macOS, where packet capture is available. On iOS the symptom is identical (preview loads, live view never starts, works with VPN off), but I have not captured packets there — I am reporting it as the same issue because the tunnel implementation is shared.

The tunnel is the primary interface:

```
$ scutil <<< "show State:/Network/Global/IPv4"
<dictionary> {
  PrimaryInterface : utun4
  Router : 10.8.0.1
}
```

The route to the camera is correctly direct:

```
$ route -n get 192.168.50.47
   route to: 192.168.50.47
  interface: en0
```

But `homed` sends SRTP from the tunnel address:

```
$ sudo tcpdump -i any -n host 192.168.50.47 and udp
21:53:23.895523 IP 10.8.0.1.64792 > 192.168.50.47.5018: UDP, length 78
21:53:24.395362 IP 10.8.0.1.64792 > 192.168.50.47.5018: UDP, length 78
21:53:24.894612 IP 10.8.0.1.64792 > 192.168.50.47.5018: UDP, length 78
21:53:25.394684 IP 10.8.0.1.64792 > 192.168.50.47.5018: UDP, length 78
```

The source is `10.8.0.1`, not the LAN address `192.168.50.168`. The same packet is retransmitted every ~500 ms with identical length, and **not a single packet comes back** from `192.168.50.47`: the accessory has no route to `10.8.0.1`, so its replies die at the LAN gateway. This also implies `SetupEndpoints` advertised `10.8.0.1` to the accessory as the controller address.

## Root cause

The system selects the primary interface among the services that own a default route. Because the tunnel installs `default -> utun`, it wins, and `homed` uses the primary interface's address as the controller address for the camera stream.

Excluding local networks fixes packet routing but not source-address selection, so it cannot resolve this on its own.

## Requested change

Allow the tunnel to install explicit routes **instead of** a default route.

With a route set that covers the whole public IPv4 space but contains no `0.0.0.0/0` entry, all internet traffic still goes through the tunnel (no leak), but no default route is installed, the tunnel does not become primary, and HomeKit works.

`sing-box-for-apple` already solves exactly this, on the same Apple stack, and may be a useful reference. It exposes these as user preferences:

```swift
public struct OverridePreferences {
    public var includeAllNetworks: Bool = false
    public var systemProxyEnabled: Bool = true
    public var excludeDefaultRoute: Bool = false
    public var autoRouteUseSubRangesByDefault: Bool = false
    public var excludeAPNsRoute: Bool = false
}
```

and applies them like this when building `NEPacketTunnelNetworkSettings`:

```swift
if inet4RouteAddressIterator.hasNext() {
    // explicit route_address from config
} else if autoRouteUseSubRangesByDefault {
    ipv4Routes.append(NEIPv4Route(destinationAddress: "1.0.0.0",   subnetMask: "255.0.0.0"))
    ipv4Routes.append(NEIPv4Route(destinationAddress: "2.0.0.0",   subnetMask: "254.0.0.0"))
    // 4/6, 8/5, 16/4, 32/3, 64/2 …
    ipv4Routes.append(NEIPv4Route(destinationAddress: "128.0.0.0", subnetMask: "128.0.0.0"))
} else {
    ipv4Routes.append(NEIPv4Route.default())
}
```

Two things there are worth having:

- **`autoRouteUseSubRangesByDefault`** — sub-ranges instead of `NEIPv4Route.default()`. This is the actual fix.
- **`excludeAPNsRoute`** — excludes `17.0.0.0/8`, keeping Apple services (APNs, iCloud, HomeKit relay) off the tunnel. Useful for HomeKit remote access independently of this bug.

A single toggle would be enough; a user-editable route list would be more flexible. If sub-ranges are used, they should be combinable with excluding local networks, since `192.168.0.0/16` still falls inside `128.0.0.0/1`.

## Scope

This affects any protocol that advertises a local address for a return path. HomeKit cameras are the most visible case, but AirPlay receivers and similar LAN peer-to-peer flows have the same shape.

Given the announced native macOS client, this seems worth designing in from the start rather than retrofitting.

**Comment by hiDandelion** [comment]
Have you tried adding your IP ranges as Excluded Routes?

**Comment by yamogoon** [comment]
Yes — "exclude local networks" is on, which is the same mechanism, and the issue already covers it under Evidence.

Excluded Routes can't fix this, because the routing is already correct. `route -n get 192.168.50.47` resolves to `en0`, and the tcpdump shows the packets do leave over `en0`. What's wrong is the **source address** on them: `10.8.0.1` instead of `192.168.50.168`.

Excluding a prefix removes it from the tunnel's route table but leaves `0.0.0.0/0` in place, so the tunnel is still the service that owns the default route and still wins `PrimaryInterface`. `homed` takes the controller address from the primary interface, not from the route to the accessory — so no set of excluded routes changes it.

The only thing that changes it is not installing `0.0.0.0/0` at all: cover the public space with sub-ranges (`1.0.0.0/8`, `2.0.0.0/7`, … `128.0.0.0/1`) so all internet traffic still goes through the tunnel with no default route present. That's what `autoRouteUseSubRangesByDefault` does in sing-box-for-apple, on the same NEPacketTunnelProvider stack.

I can verify a build with that behaviour if it helps.
